<?xml version="1.0" encoding="UTF-8"?>
<!DOCTYPE list SYSTEM "../../templates/skills.dtd">
<list>
  <skill id="900" levels="6" name="Energy Blast">
    <table name="#mpInitialConsume"> 14 14 14 14 15 15 </table>
    <table name="#mpConsume"> 57 58 59 59 60 60 </table>
    <table name="#power"> 15838 16170 16494 16807 17110 17400 </table>
    <set name="mpInitialConsume" val="#mpInitialConsume"/>
    <set name="mpConsume" val="#mpConsume"/>
    <set name="power" val="#power"/>
    <set name="magicLvl" val="83"/>
    <set name="target" val="TARGET_FRONT_AURA"/>
    <set name="skillRadius" val="100"/>
    <set name="reuseDelay" val="2000"/>
    <set name="hitTime" val="4000"/>
    <set name="skillType" val="PDAM"/>
    <set name="SSBoost" val="2.0"/>
    <set name="operateType" val="OP_ACTIVE"/>
    <set name="castRange" val="40"/>
    <set name="effectRange" val="400"/>
  </skill>
  <skill id="901" levels="6" name="Dark Strike">
    <table name="#mpInitialConsume"> 14 14 14 14 15 15 </table>
    <table name="#mpConsume"> 57 58 59 59 60 60 </table>
    <table name="#power"> 9503 9702 9896 10084 10266 10440 </table>
    <set name="mpInitialConsume" val="#mpInitialConsume"/>
    <set name="mpConsume" val="#mpConsume"/>
    <set name="power" val="#power"/>
    <set name="magicLvl" val="83"/>
    <set name="target" val="TARGET_ONE"/>
    <set name="reuseDelay" val="2000"/>
    <set name="hitTime" val="1000"/>
    <set name="skillType" val="PDAM"/>
    <set name="SSBoost" val="2.0"/>
    <set name="operateType" val="OP_ACTIVE"/>
    <set name="castRange" val="40"/>
    <set name="effectRange" val="400"/>
  </skill>
  <skill id="902" levels="6" name="Bursting Flame">
    <table name="#mpInitialConsume"> 14 14 14 14 15 15 </table>
    <table name="#mpConsume"> 57 58 59 59 60 60 </table>
    <table name="#power"> 9503 9702 9896 10084 10266 10440 </table>
    <set name="mpInitialConsume" val="#mpInitialConsume"/>
    <set name="mpConsume" val="#mpConsume"/>
    <set name="power" val="#power"/>
    <set name="magicLvl" val="83"/>
    <set name="element" val="0"/> <!-- Fire -->
    <set name="elementPower" val="20"/>
    <set name="target" val="TARGET_ONE"/>
    <set name="reuseDelay" val="2000"/>
    <set name="hitTime" val="4000"/>
    <set name="skillType" val="PDAM"/>
    <set name="SSBoost" val="2.0"/>
    <set name="operateType" val="OP_ACTIVE"/>
    <set name="castRange" val="900"/>
    <set name="effectRange" val="1400"/>
  </skill>
  <skill id="903" levels="6" name="Stratum Explosion">
    <table name="#mpInitialConsume"> 14 14 14 14 15 15 </table>
    <table name="#mpConsume"> 57 58 59 59 60 60 </table>
    <table name="#power"> 5068 5175 5278 5379 5475 5568 </table>
    <set name="mpInitialConsume" val="#mpInitialConsume"/>
    <set name="mpConsume" val="#mpConsume"/>
    <set name="power" val="#power"/>
    <set name="magicLvl" val="83"/>
    <set name="target" val="TARGET_AURA"/>
    <set name="skillRadius" val="200"/>
    <set name="reuseDelay" val="2000"/>
    <set name="hitTime" val="4000"/>
    <set name="skillType" val="PDAM"/>
    <set name="SSBoost" val="2.0"/>
    <set name="operateType" val="OP_ACTIVE"/>
  </skill>
  <skill id="904" levels="6" name="Corpse Burst">
    <table name="#mpInitialConsume"> 14 14 14 14 15 15 </table>
    <table name="#mpConsume"> 58 58 59 59 60 60 </table>
    <table name="#power"> 348 351 355 358 361 364 </table>
    <table name="#dot"> 200 225 250 275 300 325 </table>
    <set name="mpInitialConsume" val="#mpInitialConsume"/>
    <set name="mpConsume" val="#mpConsume"/>
    <set name="magicLvl" val="83"/>
    <set name="power" val="#power"/>
    <set name="target" val="TARGET_AREA_CORPSE_MOB"/>
    <set name="skillRadius" val="200"/>
    <set name="reuseDelay" val="5000"/>
    <set name="hitTime" val="1000"/>
    <set name="skillType" val="MDAM"/>
    <set name="isMagic" val="true"/>
    <set name="operateType" val="OP_ACTIVE"/>
    <set name="castRange" val="400"/>
    <set name="effectRange" val="900"/>
    <for>
      <effect count="10" name="DamOverTime" time="3" val="#dot" abnormal="poison"/>
    </for>
  </skill>
  <skill id="905" levels="6" name="Dark Detonation">
    <table name="#mpInitialConsume"> 14 14 14 14 15 15 </table>
    <table name="#mpConsume"> 57 58 59 59 60 60 </table>
    <table name="#power"> 12670 12936 13195 13446 13688 13920 </table>
    <set name="mpInitialConsume" val="#mpInitialConsume"/>
    <set name="mpConsume" val="#mpConsume"/>
    <set name="power" val="#power"/>
    <set name="magicLvl" val="83"/>
    <set name="target" val="TARGET_AURA"/>
    <set name="skillRadius" val="200"/>
    <set name="reuseDelay" val="2000"/>
    <set name="hitTime" val="4000"/>
    <set name="skillType" val="PDAM"/>
    <set name="SSBoost" val="2.0"/>
    <set name="operateType" val="OP_ACTIVE"/>
    <for>
      <effect name="Stun" time="3" val="0" stackOrder="1" stackType="Stun" effectPower="50" effectType="STUN"/>
    </for>
  </skill>
  <skill id="906" levels="6" name="Lance Step">
    <table name="#mpInitialConsume"> 14 14 14 14 15 15 </table>
    <table name="#mpConsume"> 57 58 59 59 60 60 </table>
    <table name="#power"> 9503 9702 9896 10084 10266 10440 </table>
    <set name="mpInitialConsume" val="#mpInitialConsume"/>
    <set name="mpConsume" val="#mpConsume"/>
    <set name="power" val="#power"/>
    <set name="magicLvl" val="83"/>
    <set name="target" val="TARGET_FRONT_AURA"/>
    <set name="skillRadius" val="100"/>
    <set name="reuseDelay" val="1000"/>
    <set name="hitTime" val="1000"/>
    <set name="skillType" val="PDAM"/>
    <set name="SSBoost" val="2.0"/>
    <set name="operateType" val="OP_ACTIVE"/>
  </skill>
  <skill id="907" levels="6" name="Aqua Blast">
    <table name="#mpInitialConsume"> 14 14 14 14 15 15 </table>
    <table name="#mpConsume"> 57 58 59 59 60 60 </table>
    <table name="#power"> 9503 9702 9896 10084 10266 10440 </table>
    <set name="mpInitialConsume" val="#mpInitialConsume"/>
    <set name="mpConsume" val="#mpConsume"/>
    <set name="power" val="#power"/>
    <set name="magicLvl" val="83"/>
    <set name="element" val="1"/> <!-- Water -->
    <set name="elementPower" val="20"/>
    <set name="target" val="TARGET_ONE"/>
    <set name="reuseDelay" val="2000"/>
    <set name="hitTime" val="4000"/>
    <set name="skillType" val="PDAM"/>
    <set name="SSBoost" val="2.0"/>
    <set name="operateType" val="OP_ACTIVE"/>
    <set name="castRange" val="900"/>
    <set name="effectRange" val="1400"/>
  </skill>
  <skill id="908" levels="6" name="Spin Slash">
    <table name="#mpInitialConsume"> 14 14 14 14 15 15 </table>
    <table name="#mpConsume"> 57 58 59 59 60 60 </table>
    <table name="#power"> 5068 5175 5278 5379 5475 5568 </table>
    <set name="mpInitialConsume" val="#mpInitialConsume"/>
    <set name="mpConsume" val="#mpConsume"/>
    <set name="power" val="#power"/>
    <set name="magicLvl" val="83"/>
    <set name="target" val="TARGET_AURA"/>
    <set name="reuseDelay" val="2000"/>
    <set name="hitTime" val="4000"/>
    <set name="skillType" val="PDAM"/>
    <set name="SSBoost" val="2.0"/>
    <set name="skillRadius" val="200"/>
    <set name="operateType" val="OP_ACTIVE"/>
  </skill>
  <skill id="909" levels="6" name="Ice Focus">
    <table name="#mpInitialConsume"> 14 14 14 14 15 15 </table>
    <table name="#mpConsume"> 58 58 59 59 60 60 </table>
    <table name="#power"> 348 351 355 358 361 364 </table>
    <table name="#dot"> 200 225 250 275 300 325 </table>
    <set name="mpInitialConsume" val="#mpInitialConsume"/>
    <set name="mpConsume" val="#mpConsume"/>
    <set name="power" val="#power"/>
    <set name="magicLvl" val="83"/>
    <set name="element" val="1"/> <!-- Water -->
    <set name="elementPower" val="20"/>
    <set name="target" val="TARGET_AURA"/>
    <set name="skillRadius" val="200"/>
    <set name="reuseDelay" val="4000"/>
    <set name="hitTime" val="1000"/>
    <set name="skillType" val="MDAM"/>
    <set name="isMagic" val="true"/>
    <set name="isDebuff" val="true"/>
    <set name="operateType" val="OP_ACTIVE"/>
    <for>
      <effect count="10" name="DamOverTime" time="3" val="#dot"> <!-- Value Guess -->
        <mul order="0x30" stat="runSpd" val="0.85"/>
        <mul order="0x30" stat="pAtkSpd" val="0.85"/>
        <mul order="0x30" stat="mAtkSpd" val="0.85"/>
      </effect>
    </for>
  </skill>
  <skill id="910" levels="6" name="Water Jet">
    <table name="#mpInitialConsume"> 14 14 14 14 15 15 </table>
    <table name="#mpConsume"> 57 58 59 59 60 60 </table>
    <table name="#power"> 12670 12936 13195 13446 13688 13920 </table>
    <set name="mpInitialConsume" val="#mpInitialConsume"/>
    <set name="mpConsume" val="#mpConsume"/>
    <set name="power" val="#power"/>
    <set name="magicLvl" val="83"/>
    <set name="element" val="1"/> <!-- Water -->
    <set name="elementPower" val="20"/>
    <set name="target" val="TARGET_AURA"/>
    <set name="skillRadius" val="100"/>
    <set name="reuseDelay" val="2000"/>
    <set name="hitTime" val="4000"/>
    <set name="skillType" val="PDAM"/>
    <set name="SSBoost" val="2.0"/>
    <set name="operateType" val="OP_ACTIVE"/>
  </skill>
  <skill id="911" levels="11" name="Energy Burst">
    <!-- Aurabird Falcon & Owl -->
    <table name="#power"> 469 482 494 505 517 528 539 550 561 571 580 </table>
    <table name="#mpInitialConsume"> 13 14 14 14 14 14 14 14 14 15 15 </table>
    <table name="#mpConsume"> 55 56 56 56 57 57 58 59 59 60 60 </table>
    <table name="#magicLvl"> 75 76 77 78 79 80 81 82 83 84 85 </table>
    <set name="power" val="#power"/>
    <set name="mpInitialConsume" val="#mpInitialConsume"/>
    <set name="mpConsume" val="#mpConsume"/>
    <set name="magicLvl" val="#magicLvl"/>